{"dataset":"eips","api_version":"v1","schema_version":"1.1.0","schema_url":"https://blockchains.github.io/blockchainlab-api/v1/schemas/eips.schema.json","description":"EIPS index (number, title, status, type, category) parsed from ethereum/EIPs.","generated_at":"2026-10-24T08:10:22.498Z","source":"github.com/ethereum/EIPs","source_url":"https://github.com/ethereum/EIPs/tree/master/EIPS","built_by":"Blockchain Lab — https://blockchainlab.com","licence_note":"Data belongs to the named source; check its terms before reuse. Attribute the source and Blockchain Lab.","count":605,"data":[{"number":1,"title":"EIP Purpose and Guidelines","status":"Living","type":"Meta","category":null,"created":"2015-10-27","requires":[],"url":"https://eips.ethereum.org/EIPS/eip-1"},{"number":2,"title":"Homestead Hard-fork Changes","status":"Final","type":"Standards Track","category":"Core","created":"2015-11-15","requires":[],"url":"https://eips.ethereum.org/EIPS/eip-2"},{"number":3,"title":"Addition of CALLDEPTH opcode","status":"Withdrawn","type":"Standards Track","category":"Core","created":"2015-11-19","requires":[],"url":"https://eips.ethereum.org/EIPS/eip-3"},{"number":4,"title":"EIP Classification","status":"Final","type":"Meta","category":null,"created":"2015-11-17","requires":[],"url":"https://eips.ethereum.org/EIPS/eip-4"},{"number":5,"title":"Gas Usage for `RETURN` and `CALL*`","status":"Final","type":"Standards Track","category":"Core","created":"2015-11-22","requires":[],"url":"https://eips.ethereum.org/EIPS/eip-5"},{"number":6,"title":"Renaming SUICIDE opcode","status":"Final","type":"Standards Track","category":"Interface","created":"2015-11-22","requires":[],"url":"https://eips.ethereum.org/EIPS/eip-6"},{"number":7,"title":"DELEGATECALL","status":"Final","type":"Standards Track","category":"Core","created":"2015-11-15","requires":[],"url":"https://eips.ethereum.org/EIPS/eip-7"},{"number":8,"title":"devp2p Forward Compatibility Requirements for Homestead","status":"Final","type":"Standards Track","category":"Networking","created":"2015-12-18","requires":[],"url":"https://eips.ethereum.org/EIPS/eip-8"},{"number":86,"title":"Abstraction of transaction origin and signature","status":"Stagnant","type":"Standards Track","category":"Core","created":"2017-02-10","requires":[],"url":"https://eips.ethereum.org/EIPS/eip-86"},{"number":100,"title":"Change difficulty adjustment to target mean block time including uncles","status":"Final","type":"Standards Track","category":"Core","created":"2016-04-28","requires":[],"url":"https://eips.ethereum.org/EIPS/eip-100"},{"number":101,"title":"Serenity Currency and Crypto Abstraction","status":"Stagnant","type":"Standards Track","category":"Core","created":"2015-11-15","requires":[],"url":"https://eips.ethereum.org/EIPS/eip-101"},{"number":107,"title":"safe \"eth_sendTransaction\" authorization via html popup","status":"Stagnant","type":"Standards Track","category":"Interface","created":"2016-06-05","requires":[],"url":"https://eips.ethereum.org/EIPS/eip-107"},{"number":140,"title":"REVERT instruction","status":"Final","type":"Standards Track","category":"Core","created":"2017-02-06","requires":[],"url":"https://eips.ethereum.org/EIPS/eip-140"},{"number":141,"title":"Designated invalid EVM instruction","status":"Final","type":"Standards Track","category":"Core","created":"2017-02-09","requires":[],"url":"https://eips.ethereum.org/EIPS/eip-141"},{"number":145,"title":"Bitwise shifting instructions in EVM","status":"Final","type":"Standards Track","category":"Core","created":"2017-02-13","requires":[],"url":"https://eips.ethereum.org/EIPS/eip-145"},{"number":150,"title":"Gas cost changes for IO-heavy operations","status":"Final","type":"Standards Track","category":"Core","created":"2016-09-24","requires":[],"url":"https://eips.ethereum.org/EIPS/eip-150"},{"number":152,"title":"Add BLAKE2 compression function `F` precompile","status":"Final","type":"Standards Track","category":"Core","created":"2016-10-04","requires":[],"url":"https://eips.ethereum.org/EIPS/eip-152"},{"number":155,"title":"Simple replay attack protection","status":"Final","type":"Standards Track","category":"Core","created":"2016-10-14","requires":[],"url":"https://eips.ethereum.org/EIPS/eip-155"},{"number":158,"title":"State clearing","status":"Final","type":"Standards Track","category":"Core","created":"2016-10-16","requires":[],"url":"https://eips.ethereum.org/EIPS/eip-158"},{"number":160,"title":"EXP cost increase","status":"Final","type":"Standards Track","category":"Core","created":"2016-10-20","requires":[],"url":"https://eips.ethereum.org/EIPS/eip-160"},{"number":161,"title":"State trie clearing (invariant-preserving alternative)","status":"Final","type":"Standards Track","category":"Core","created":"2016-10-24","requires":[],"url":"https://eips.ethereum.org/EIPS/eip-161"},{"number":170,"title":"Contract code size limit","status":"Final","type":"Standards Track","category":"Core","created":"2016-11-04","requires":[],"url":"https://eips.ethereum.org/EIPS/eip-170"},{"number":196,"title":"Precompiled contracts for addition and scalar multiplication on the elliptic curve alt_bn128","status":"Final","type":"Standards Track","category":"Core","created":"2017-02-02","requires":[],"url":"https://eips.ethereum.org/EIPS/eip-196"},{"number":197,"title":"Precompiled contracts for optimal ate pairing check on the elliptic curve alt_bn128","status":"Final","type":"Standards Track","category":"Core","created":"2017-02-06","requires":[],"url":"https://eips.ethereum.org/EIPS/eip-197"},{"number":198,"title":"Big integer modular exponentiation","status":"Final","type":"Standards Track","category":"Core","created":"2017-01-30","requires":[],"url":"https://eips.ethereum.org/EIPS/eip-198"},{"number":210,"title":"Blockhash refactoring","status":"Stagnant","type":"Standards Track","category":"Core","created":"2017-02-10","requires":[],"url":"https://eips.ethereum.org/EIPS/eip-210"},{"number":211,"title":"\"New opcodes: RETURNDATASIZE and RETURNDATACOPY\"","status":"Final","type":"Standards Track","category":"Core","created":"2017-02-13","requires":[],"url":"https://eips.ethereum.org/EIPS/eip-211"},{"number":214,"title":"New opcode STATICCALL","status":"Final","type":"Standards Track","category":"Core","created":"2017-02-13","requires":[],"url":"https://eips.ethereum.org/EIPS/eip-214"},{"number":225,"title":"Clique proof-of-authority consensus protocol","status":"Final","type":"Standards Track","category":"Core","created":"2017-03-06","requires":[],"url":"https://eips.ethereum.org/EIPS/eip-225"},{"number":233,"title":"Formal process of hard forks","status":"Stagnant","type":"Meta","category":null,"created":"2017-03-23","requires":[],"url":"https://eips.ethereum.org/EIPS/eip-233"},{"number":234,"title":"Add `blockHash` to JSON-RPC filter options.","status":"Final","type":"Standards Track","category":"Interface","created":"2017-03-24","requires":[1474],"url":"https://eips.ethereum.org/EIPS/eip-234"},{"number":606,"title":"\"Hardfork Meta: Homestead\"","status":"Final","type":"Meta","category":null,"created":"2017-04-23","requires":[2,7,8],"url":"https://eips.ethereum.org/EIPS/eip-606"},{"number":607,"title":"\"Hardfork Meta: Spurious Dragon\"","status":"Final","type":"Meta","category":null,"created":"2017-04-23","requires":[155,160,161,170,608],"url":"https://eips.ethereum.org/EIPS/eip-607"},{"number":608,"title":"\"Hardfork Meta: Tangerine Whistle\"","status":"Final","type":"Meta","category":null,"created":"2017-04-23","requires":[150,779],"url":"https://eips.ethereum.org/EIPS/eip-608"},{"number":609,"title":"\"Hardfork Meta: Byzantium\"","status":"Final","type":"Meta","category":null,"created":"2017-04-23","requires":[100,140,196,197,198,211,214,607,649,658],"url":"https://eips.ethereum.org/EIPS/eip-609"},{"number":615,"title":"Subroutines and Static Jumps for the EVM","status":"Stagnant","type":"Standards Track","category":"Core","created":"2016-12-10","requires":[],"url":"https://eips.ethereum.org/EIPS/eip-615"},{"number":616,"title":"SIMD Operations for the EVM","status":"Stagnant","type":"Standards Track","category":"Core","created":"2017-04-25","requires":[],"url":"https://eips.ethereum.org/EIPS/eip-616"},{"number":627,"title":"Whisper Specification","status":"Final","type":"Standards Track","category":"Networking","created":"2017-05-05","requires":[],"url":"https://eips.ethereum.org/EIPS/eip-627"},{"number":649,"title":"Metropolis Difficulty Bomb Delay and Block Reward Reduction","status":"Final","type":"Standards Track","category":"Core","created":"2017-06-21","requires":[],"url":"https://eips.ethereum.org/EIPS/eip-649"},{"number":658,"title":"Embedding transaction status code in receipts","status":"Final","type":"Standards Track","category":"Core","created":"2017-06-30","requires":[140],"url":"https://eips.ethereum.org/EIPS/eip-658"},{"number":663,"title":"SWAPN, DUPN and EXCHANGE instructions","status":"Stagnant","type":"Standards Track","category":"Core","created":"2017-07-03","requires":[3540,5450],"url":"https://eips.ethereum.org/EIPS/eip-663"},{"number":665,"title":"Add precompiled contract for Ed25519 signature verification","status":"Stagnant","type":"Standards Track","category":"Core","created":"2018-03-25","requires":[],"url":"https://eips.ethereum.org/EIPS/eip-665"},{"number":684,"title":"Revert creation in case of collision","status":"Final","type":"Standards Track","category":"Core","created":"2023-03-20","requires":[],"url":"https://eips.ethereum.org/EIPS/eip-684"},{"number":689,"title":"Address Collision of Contract Address Causes Exceptional Halt","status":"Stagnant","type":"Standards Track","category":"Core","created":"2017-08-15","requires":[],"url":"https://eips.ethereum.org/EIPS/eip-689"},{"number":695,"title":"Create `eth_chainId` method for JSON-RPC","status":"Final","type":"Standards Track","category":"Interface","created":"2017-08-21","requires":[155],"url":"https://eips.ethereum.org/EIPS/eip-695"},{"number":69